{
  "schemaVersion": 1,
  "id": "0006",
  "spec": "specs/0006-build-info.md",
  "specDigest": "083ac65d21a61304f52f699c4c0b06dab0f098ec84f490c2c1e9aa0216d47fb3",
  "baseCommit": "d986eb921f76a80f56787590612fea683cf30f27",
  "planner": {
    "provider": "claude-code",
    "model": "opus"
  },
  "tasks": [
    {
      "id": "build-metadata-vite",
      "owner": "apps/web/vite.config.js",
      "description": "Lisää apps/web/vite.config.js:ään käännösaikaisen rakennustiedon tuottaminen. Laske build-vaiheen alkuhetki konfiguraation latautuessa ja muotoile se merkkijonoksi muodossa 'dd.MM.yyyy HH:mm:ss' (24 tunnin kello, kaksinumeroiset päivä, kuukausi, tunti, minuutti ja sekunti). Selvitä rakennettavan Git-commitin lyhyt tiiviste lukemalla commitin tiiviste Gitistä (esim. node:child_process execFileSync 'git rev-parse HEAD') ja katkaise se seitsemään ensimmäiseen merkkiin. Jos Git-tietoa ei ole saatavilla, käytä turvallista varatekstiä kaatumatta. Vie tiedot Viten define-asetuksella vakioon __BUILD_INFO__ JSON-serialisoituna oliona, jossa on kentät buildTime ja commit, jotta frontend voi korvata footerin paikanvaraajan käännöksessä. Säilytä nykyiset root-, build- ja server-asetukset ennallaan.",
      "spec": "specs/0006-build-info.md",
      "allowedPaths": [
        "apps/web/vite.config.js"
      ],
      "acceptanceCriteria": [
        "apps/web/vite.config.js määrittelee define-asetuksessa vakion __BUILD_INFO__, jonka arvo on JSON.stringify-muotoiltu olio kentillä buildTime ja commit.",
        "buildTime-arvo on build-vaiheen alkuhetki muodossa 'dd.MM.yyyy HH:mm:ss', jossa tunnit ovat 24 tunnin kellossa ja kaikki osat kaksinumeroisia (nelinumeroinen vuosi).",
        "commit-arvo on rakennettavan Git-commitin tiivisteen seitsemän ensimmäistä merkkiä.",
        "Jos Git-komento ei ole käytettävissä tai se epäonnistuu, konfiguraatio ei heitä virhettä vaan käyttää varatekstiä commit-kentässä.",
        "Nykyiset asetukset root, build.outDir, build.emptyOutDir ja server säilyvät entisellään, eikä tiedosto tuo riippuvuuksia apps/web/-hakemiston ulkopuolelta."
      ],
      "dependsOn": []
    },
    {
      "id": "footer-build-info",
      "owner": "apps/web/src/main.jsx",
      "description": "Lisää apps/web/src/main.jsx:n footeriin paikanvaraaja rakennustiedolle ja näytä siinä käännöksessä korvattu arvo. Lue vakio __BUILD_INFO__ siten, että kehitysajossa (kun vakiota ei ole määritelty) footer näyttää neutraalin varatekstin eikä sovellus kaadu. Näytä footerissa nykyisen tekstin lisäksi build-vaiheen alkuaika muodossa 'dd.MM.yyyy HH:mm:ss' sekä commitin seitsenmerkkinen lyhyt tiiviste suomenkielisellä, lyhyellä selitteellä. Älä muuta muuta footerin sisältöä tai sovelluksen muuta toimintaa.",
      "spec": "specs/0006-build-info.md",
      "allowedPaths": [
        "apps/web/src/main.jsx"
      ],
      "acceptanceCriteria": [
        "Footer renderöi erillisen rakennustiedon paikanvaraajan, joka saa arvonsa vakiosta __BUILD_INFO__ (kentät buildTime ja commit).",
        "Footerissa näkyy build-vaiheen alkuaika muodossa 'dd.MM.yyyy HH:mm:ss' ja commitin seitsenmerkkinen lyhyt tiiviste.",
        "Jos __BUILD_INFO__ ei ole määriteltynä (kehitysajo), footer näyttää varatekstin eikä renderöinti kaadu ReferenceError-virheeseen.",
        "Footerin aiempi teksti 'Yksi idea. Yksi askel kerrallaan.' säilyy ja muut näkymät sekä kirjautumislogiikka pysyvät muuttumattomina.",
        "Muutokset rajoittuvat tiedostoon apps/web/src/main.jsx."
      ],
      "dependsOn": [
        "build-metadata-vite"
      ]
    }
  ]
}
