{
  "schemaVersion": 1,
  "id": "0003",
  "spec": "specs/0003-shopping-lists.md",
  "specDigest": "c4c991c34cd5113409270bfc555796c3915ccf5181f07c2df3db7894333490ba",
  "baseCommit": "d46ebcee54b968b231aa3a10a86f03365ec23616",
  "planner": {
    "provider": "claude-code",
    "model": "sonnet"
  },
  "tasks": [
    {
      "id": "shopping-lists-backend",
      "owner": "apps/api",
      "description": "Toteuta ostoslistojen backend-rajapinta speksin 0003 mukaisesti. Lisaa apps/api/handler.mjs:aan kirjautumista vaativat reitit: GET /api/shopping-lists (listaa kaikki ostoslistat), POST /api/shopping-lists (luo uuden), GET /api/shopping-lists/{id} (hae yksi), PUT /api/shopping-lists/{id} (paivita nimi ja/tai tuotteet kokonaan) ja DELETE /api/shopping-lists/{id} (poista). Laajenna apps/api/store.mjs niin, etta seka dynamoStore etta memoryStore tukevat kaikkien 'LIST#'-alkuisten tietueiden listaamista (esim. Scan-operaatio) olemassa olevaa DynamoDB-taulua muuttamatta - infra-koodiin ei kosketa. Ostoslista tallennetaan yhtena tietueena (id, nimi, tuotteet-taulukko, aikaleima), jotta nimen tai tuotelistan muokkaus tallentuu automaattisesti ilman erillista tallenna-reittia. Kirjoita kattavat yksikkotestit tiedostoon tests/shopping-lists.test.mjs muistissa toimivaa storea kayttaen.",
      "spec": "specs/0003-shopping-lists.md",
      "allowedPaths": [
        "apps/api",
        "tests"
      ],
      "acceptanceCriteria": [
        "handler.mjs sisaltaa reitit GET/POST /api/shopping-lists seka GET/PUT/DELETE /api/shopping-lists/{id}, ja ne palauttavat 401, jos pyynnossa ei ole voimassa olevaa istuntoa",
        "store.mjs:ssa on uusi toiminto, joka listaa kaikki ostoslistat seka DynamoDB- etta muisti-toteutuksessa, eika infra/app.mjs:aa ole muutettu",
        "Ostoslistan luonti palauttaa uuden listan id:n ja oletusarvot (nimi, tyhja tuotelista)",
        "PUT-reitti paivittaa ostoslistan nimen ja/tai tuotteet kokonaisuudessaan yhdella kutsulla niin, etta muutos nakyy heti seuraavassa GET-kutsussa",
        "DELETE-reitti poistaa ostoslistan pysyvasti tietokannasta",
        "tests/shopping-lists.test.mjs kattaa listauksen, luonnin, paivityksen, poiston ja kirjautumattoman kayttajan 401-vastauksen, ja npm run check lapaisee kaikki tarkistukset"
      ],
      "dependsOn": []
    },
    {
      "id": "shopping-lists-frontend",
      "owner": "apps/web",
      "description": "Lisaa frontendiin speksin 0003 mukainen valilehtinavigaatio ja ostoslistojen hallintanakyma. Nykyinen etusivunakyma nimetaan 'Home'-valilehdeksi ja sen rinnalle tulee 'Shopping lists'-valilehti; 'Home' on oletuksena aktiivinen kirjautumisen jalkeen. 'Shopping lists'-valilehti listaa backendista haetut ostoslistat, ja kayttaja voi luoda uuden listan, avata olemassa olevan muokattavaksi tai poistaa sen. Muokkausnakymassa listan nimea voi muuttaa ja kunkin olemassa olevan tuotteen perassa on 'X'-painike sen poistamiseksi; kaikki muutokset (nimi, tuotteen lisays/poisto) tallentuvat automaattisesti kutsumalla backendin PUT-reittia eika erillista tallenna-painiketta ole. Muokkausnakymasta paasee erillisella toiminnolla takaisin ostoslistojen listaukseen.",
      "spec": "specs/0003-shopping-lists.md",
      "allowedPaths": [
        "apps/web",
        "tests"
      ],
      "acceptanceCriteria": [
        "Sovelluksessa nakyy kaksi valilehtea, 'Home' ja 'Shopping lists', ja 'Home' on aktiivinen heti kirjautumisen jalkeen",
        "'Shopping lists'-valilehti hakee ja nayttaa backendista saadut olemassa olevat ostoslistat",
        "Kayttaja voi luoda uuden ostoslistan, avata olemassa olevan muokattavaksi ja poistaa olemassa olevan listan kayttoliittymasta",
        "Muokkausnakymassa listan nimea voi muokata ja jokaisen olemassa olevan tuotteen perassa on 'X'-painike, joka poistaa tuotteen listalta",
        "Nimen tai tuotteiden muutokset tallentuvat automaattisesti backendiin ilman erillista tallenna-painiketta, ja kayttaja paasee erillisella paluutoiminnolla takaisin listojen listaukseen",
        "npm run check (lint, testit, build) lapaisee frontend-muutosten jalkeen"
      ],
      "dependsOn": [
        "shopping-lists-backend"
      ]
    },
    {
      "id": "shopping-lists-docs",
      "owner": "docs",
      "description": "Paivita dokumentaatio kuvaamaan uusi ostoslistaominaisuus. Kuvaa docs/architecture.md:ssa (tai erillisessa docs-tiedostossa) uudet /api/shopping-lists-reitit, tietomalli (yksi tietue per ostoslista, nimi ja tuotteet) ja se, etta ostoslistat tallennetaan olemassa olevaan DynamoDB-tauluun infraa muuttamatta.",
      "spec": "specs/0003-shopping-lists.md",
      "allowedPaths": [
        "docs"
      ],
      "acceptanceCriteria": [
        "docs/architecture.md (tai uusi docs-tiedosto) kuvaa ostoslistojen API-reitit: listaus, luonti, haku, paivitys ja poisto",
        "Dokumentaatiossa mainitaan, etta ostoslistat tallennetaan olemassa olevaan DynamoDB-tauluun ja etta infra-koodiin ei tehty muutoksia taman speksin yhteydessa",
        "Dokumentaatio kuvaa, etta muutokset tallentuvat automaattisesti eika erillista tallenna-painiketta ole"
      ],
      "dependsOn": [
        "shopping-lists-backend"
      ]
    }
  ]
}
